{
  "$schema": "https://json-schema.org/draft/2020-12/schema",
  "$id": "https://theparitt.github.io/sppa-protocol/schemas/0.1.0/artifact.schema.json",
  "title": "SPPA artifact (Draft 0.1.0)",
  "type": "object",
  "properties": {
    "ref": {
      "type": "string",
      "pattern": "^artifact://[a-z0-9]+(?:[.-][a-z0-9]+)+/art_[A-Za-z0-9_-]{8,64}$",
      "maxLength": 256
    },
    "provider_id": {
      "type": "string",
      "pattern": "^[a-z0-9]+(?:[.-][a-z0-9]+)+$",
      "maxLength": 128
    },
    "artifact_id": {
      "type": "string",
      "pattern": "^art_[A-Za-z0-9_-]{8,64}$"
    },
    "owner": {
      "type": "string",
      "format": "uri",
      "maxLength": 2048
    },
    "media_type": {
      "type": "string",
      "minLength": 1,
      "maxLength": 1024
    },
    "size_bytes": {
      "type": "integer",
      "minimum": 0,
      "maximum": 9007199254740991
    },
    "sha256": {
      "type": "string",
      "pattern": "^sha256:[a-f0-9]{64}$"
    },
    "privacy": {
      "type": "string",
      "enum": [
        "public",
        "private",
        "confidential",
        "local_only"
      ]
    },
    "created_at": {
      "type": "string",
      "format": "date-time",
      "pattern": "^\\d{4}-\\d{2}-\\d{2}T\\d{2}:\\d{2}:[0-5]\\d(?:\\.\\d{1,3})?Z$"
    },
    "retention_until": {
      "type": "string",
      "format": "date-time",
      "pattern": "^\\d{4}-\\d{2}-\\d{2}T\\d{2}:\\d{2}:[0-5]\\d(?:\\.\\d{1,3})?Z$"
    },
    "created_by_job": {
      "type": "string",
      "pattern": "^job_[A-Za-z0-9_-]{8,64}$"
    }
  },
  "required": [
    "ref",
    "provider_id",
    "artifact_id",
    "owner",
    "media_type",
    "size_bytes",
    "sha256",
    "privacy",
    "created_at",
    "retention_until"
  ],
  "additionalProperties": false
}
